{
  "schemaVersion": 1,
  "repository": "neophilism/FOIA_Bias_Analysis",
  "updatedAt": "2026-10-12T13:18:45.282Z",
  "standard": {
    "repository": "neophilism/End-To-End-Everywhere-Security-Architecture-Standard",
    "commit": "8441335f359c6e446f9bfe8b959f9606ce341409",
    "basis": "development"
  },
  "inventory": {
    "path": "security/e2eesa-inventory.json",
    "reviewed": false
  },
  "source": {
    "algorithm": "git-blob-manifest-sha256-v1",
    "digest": null,
    "assessedCommit": null
  },
  "implementation": {
    "complete": false,
    "controls": [],
    "evidence": [],
    "pending": [
      "Complete and review the component/data-flow inventory and source-bound control assessment."
    ]
  },
  "testing": {
    "complete": false,
    "checks": [],
    "evidence": [],
    "pending": [
      "Bind all six required checks and applicable integration/runtime tests to the assessed source."
    ]
  },
  "independentReview": {
    "complete": false,
    "reviewers": [],
    "evidence": [],
    "ownerAccepted": false,
    "sourceDigest": null,
    "pending": [
      "Owner-arranged independent qualified expert review remains pending."
    ]
  },
  "existingSecurityEvidence": [],
  "nextActions": [
    "Preserve the Aggregator-owned shared corpus architecture and completed comparable-term cohort; replace the legacy source-specific scaffold only through approved FBA milestones.",
    "Read the product plan, AGENTS, current implementation, security pins and the existing evidence listed above; preserve approved scope.",
    "Complete and independently review the source/build/runtime component and data-flow inventory using the pinned upstream contracts.",
    "Implement or close unverified protected flows; retain intentional public data and authorized business processing boundaries.",
    "Verify all six required gates and actual applicable integrations/platforms on the same source, preserving immutable reports.",
    "Keep the owner-arranged independent expert review unchecked until qualified authenticated review and owner acceptance are recorded."
  ]
}
